{
  "schema_name": "sound_plan",
  "schema_version": "1.0.0",
  "artifact_id": "art_sound_plan",
  "project_id": "prj_demo",
  "revision_id": "rev_001",
  "created_at": "2026-07-22T10:00:00Z",
  "producer": {
    "application_version": "0.1.0",
    "stage": "example",
    "adapter": "fixture",
    "adapter_version": "1"
  },
  "inputs": [
    {
      "artifact_id": "art_edl",
      "sha256": "aaaaaaaaaaaaaaaaaaaaaaaaaaaaaaaaaaaaaaaaaaaaaaaaaaaaaaaaaaaaaaaa"
    }
  ],
  "config_sha256": "0000000000000000000000000000000000000000000000000000000000000000",
  "catalog_id": "cat_local_sfx",
  "cues": [
    {
      "cue_id": "sfx_001",
      "start_us": 2400000,
      "end_us": 2700000,
      "asset_id": "snd_soft_whoosh",
      "asset_sha256": "dddddddddddddddddddddddddddddddddddddddddddddddddddddddddddddddd",
      "license_id": "license_internal_001",
      "purpose": "Support a key point card entrance",
      "gain_db": -16.0,
      "fade_in_us": 20000,
      "fade_out_us": 80000,
      "duck_speech": true,
      "approval_state": "approved",
      "linked_transition_id": "trn_new_point_001",
      "sync_peak_us": 2520000,
      "transient_peak_offset_us": 120000,
      "speech_clearance_us": 90000,
      "mix_policy": "speech_priority",
      "minimum_reuse_interval_us": 45000000,
      "qa_status": "pass",
      "transient_alignment_status": "pass",
      "transient_alignment_tolerance_us": 30000,
      "speech_protection": {
        "minimum_clearance_us": 90000,
        "first_important_word_us": 2790000,
        "status": "pass"
      },
      "reuse_status": "pass"
    }
  ],
  "warnings": []
}
